{
  "$schema": "https://json-schema.org/draft/2020-12/schema",
  "$id": "urn:auditoryworks:axiom:verification:platform-scenario:v1",
  "type": "object",
  "additionalProperties": false,
  "required": ["format", "formatVersion", "id", "requirementStatus", "requirementIds", "authorityRefs", "targets", "preconditions", "steps", "expected", "capture"],
  "properties": {
    "format": { "const": "axiom-platform-scenario-v1" },
    "formatVersion": { "const": 1 },
    "id": { "type": "string", "pattern": "^PLAT-[A-Z0-9-]+$" },
    "requirementStatus": { "enum": ["SPEC_REQUIREMENT", "FREEZE_CANDIDATE", "BENCHMARK_TARGET", "EXPERIMENTAL_TARGET", "OPEN"] },
    "requirementIds": { "type": "array", "minItems": 1, "uniqueItems": true, "items": { "type": "string", "minLength": 1 } },
    "authorityRefs": { "type": "array", "minItems": 1, "items": { "type": "string", "minLength": 1 } },
    "canonicalFixtureRef": { "type": "string", "minLength": 1 },
    "targets": { "type": "array", "minItems": 1, "items": { "$ref": "#/$defs/target" } },
    "preconditions": { "type": "object" },
    "steps": { "type": "array", "minItems": 1, "items": { "$ref": "#/$defs/step" } },
    "expected": { "type": "object" },
    "capture": { "type": "object" }
  },
  "$defs": {
    "target": {
      "type": "object", "additionalProperties": false,
      "required": ["platformFamily", "policy", "requiredCapabilities"],
      "properties": {
        "platformFamily": { "enum": ["WEB", "WINDOWS", "ANDROID", "APPLE"] },
        "policy": { "enum": ["REQUIRED", "REQUIRED_WHEN_CAPABLE"] },
        "requiredCapabilities": { "type": "array", "uniqueItems": true, "items": { "type": "string", "pattern": "^[a-z][a-z0-9_]*(?:\\.[a-z0-9_]+)+$" } }
      }
    },
    "step": {
      "type": "object", "additionalProperties": false,
      "required": ["stepId", "kind", "action", "completion"],
      "properties": {
        "stepId": { "type": "string", "pattern": "^[a-z][a-z0-9-]+$" },
        "kind": { "enum": ["CONTROL", "APP_LIFECYCLE", "METRICS_UPDATE", "SEMANTIC", "BRIDGE", "INPUT", "FAULT", "WAIT"] },
        "action": { "type": "object" },
        "completion": { "type": "object" }
      }
    }
  }
}
