{"format":"axiom-platform-scenario-v1","formatVersion":1,"id":"PLAT-SCHEMA-001","requirementStatus":"EXPERIMENTAL_TARGET","requirementIds":["REQ-GAP-VER"],"authorityRefs":["repository:GT-G0-01"],"targets":[{"platformFamily":"WEB","policy":"REQUIRED","requiredCapabilities":[]}],"preconditions":{},"steps":[{"stepId":"s01","kind":"CONTROL","action":{},"completion":{}}],"expected":{},"capture":{}}
